rank,product,price,summary
1,Trailfinders,Varies,Top-rated for tailor-made holiday experiences.
2,TUI,Varies,Popular for budget-friendly package holidays.
3,Jet2 Holidays,Varies,Known for great deals on flights and hotels.
4,On The Go Tours,Varies,Offers unique guided tours across various destinations.
5,Rabbie's Tours,Varies,Specializes in small group tours for a personalized experience.
6,Trafalgar,Varies,Renowned for immersive travel experiences.
7,British Heritage Tours,Varies,Focuses on cultural and historical tours in the UK.
8,Back-Roads Touring,Varies,Offers scenic routes and local experiences.
9,Audley Travel,Varies,Customizes trips based on personal preferences.
10,InsideJapan Tours,Varies,Expert in travel to Japan with tailored itineraries.
