rank,product,price,summary
1,Hobonichi Techo Planner,$42,Highly regarded for its quality paper and versatile layout.
2,Leuchtturm1917 Weekly Planner + Notebook Medium (A5),$26,"Combines a planner with a notebook, perfect for note-taking and scheduling."
3,Happy Planner,$30,"Customizable and colorful, great for creative planning."
4,Erin Condren Coiled Weekly LifePlanner,$55,Known for its stylish design and extensive customization options.
5,Clever Fox Planner,$25,Focuses on productivity and goal-setting with a structured layout.
6,Muji Recycled Paper Weekly Planner,$15,Minimalist design with eco-friendly materials.
7,Blue Sky 2024 Weekly Monthly Appointment Book,$13,Affordable and practical for everyday scheduling.
8,Sugar Paper Essentials 2023-24 Academic Planner,$21,"Ideal for students, with an academic year layout."
9,Hemlock & Oak Minimal Weekly Planner,$30,"Loved for its quality paper and clean, functional design."
10,Papier Weekly Planner,$40,Stylish and personalized options available for a unique touch.
